course_id,course_title,is_paid,price,num_subscribers,num_reviews,num_lectures,level,content_duration,published_timestamp,subject,language,rating,year_published
729552,JavaScript for Beginners Welcome to learning JavaScript,Pago,50,10864,63,26,Beginner Level,2.0,2016-02-01,Web Development,English,3.9,2016
499632,Benefits of Thinking Mobile First Future of Website Design,Pago,75,14254,27,20,Beginner Level,1.5,2015-05-13,Web Development,English,4.4,2015
959586,Javascript from Beginner to Advanced Level,Pago,195,6134,160,50,Beginner Level,6.5,2016-12-19,Web Development,English,4.23,2016
16151,AJAX Development,Pago,20,7867,147,23,All Levels,3.0,2012-05-15,Web Development,English,4.5,2012
856490,Interaction Design Specialist For Web Developers,Pago,95,8594,37,18,All Levels,2.0,2016-07-04,Web Development,English,4.0,2016
861528,PHP Security,Pago,50,1892,147,24,All Levels,2.5,2016-06-15,Web Development,English,4.3,2016
912996,The Bubble Course - Create Complete Web Apps without Coding,Pago,30,3960,220,47,Beginner Level,4.5,2016-07-24,Web Development,English,3.7,2016
559512,The Complete HTML5 & CSS3 Course Build Professional Websites,Pago,195,10518,129,57,All Levels,4.5,2015-08-11,Web Development,English,3.4,2015
922600,CSS Web Development Crash Course,Pago,20,10008,53,26,Beginner Level,2.5,2016-12-01,Web Development,English,4.1,2016
976284,Mastering DevOps,Pago,100,1023,118,38,Intermediate Level,6.0,2016-10-21,Web Development,English,4.9,2016
976598,Building Websites Create a fully functional Web contact form,Pago,200,3392,29,19,Beginner Level,1.5,2016-10-06,Web Development,English,4.0,2016
718426,Create a Dynamic User Registration Form from scratch,Pago,100,7213,50,38,Beginner Level,3.0,2016-01-09,Web Development,English,3.5,2016
304490,A 13 Hour SQL Server 2014 /ASP.NET/CSS/C#/jQuery Course,Pago,35,4183,231,86,Intermediate Level,14.0,2014-10-12,Web Development,English,4.5,2014
15285,HTML Workshop,Pago,20,25854,306,17,All Levels,2.0,2012-04-08,Web Development,English,4.23,2012
477702,Python for Beginners: Python Programming Language | Tutorial,Pago,150,6153,125,84,Beginner Level,5.0,2015-06-14,Web Development,English,4.23,2015
875882,Creating Animations using HTML5 Canvas,Pago,25,4010,17,12,All Levels,1.0,2016-06-13,Web Development,English,4.23,2016
861122,Bootstrap 4: Exploring New Features,Pago,75,5022,38,13,All Levels,1.0,2016-05-27,Web Development,English,4.23,2016
309370,Bootstrap 3 -> Profitable WordPress Theme Development!,Pago,40,5547,80,40,All Levels,3.5,2014-10-22,Web Development,English,3.8,2014
802268,Intro to Git,Pago,20,2532,291,30,Beginner Level,1.0,2016-06-28,Web Development,English,4.5,2016
1034520,WordPress Domination #2: Leads & Scarcity,Pago,95,2362,4,13,Beginner Level,1.0,2017-01-10,Web Development,English,4.23,2017
1016536,Learn How to Manage & Customize  Web Sites By Drupal CMS,Pago,140,7741,9,36,All Levels,2.5,2016-12-11,Web Development,English,3.5,2016
711592,Using Modern JavaScript Today,Pago,50,1658,185,68,Intermediate Level,16.5,2016-01-01,Web Development,English,4.6,2016
1065250,Up and Running with jQuery,Gratis,0,3324,138,19,All Levels,5.0,2017-02-03,Web Development,English,4.7,2017
928858,Learn How To Build A Professional Web Site By Using Joomla,Pago,70,7184,22,29,All Levels,4.0,2016-08-11,Web Development,English,4.2,2016
791030,Power up HTML5 with JavaScript,Pago,100,4442,23,28,Beginner Level,2.0,2016-03-15,Web Development,English,4.7,2016
1241518,Node Package Manager Course: Build and Publish NPM Modules,Pago,30,7196,8,38,All Levels,6.5,2017-06-06,Web Development,English,3.2,2017
944886,WordPress Look and Feel with Themes,Pago,25,2371,10,12,Beginner Level,1.0,2016-09-04,Web Development,English,4.23,2016
758582,PHP with Laravel for beginners - Become a Master in Laravel,Pago,150,8496,1838,308,All Levels,29.5,2016-04-21,Web Development,English,4.3,2016
1199774,JavaScript 2017: Become Top Rated Web Developer,Pago,115,1346,330,32,All Levels,3.0,2017-05-03,Web Development,English,3.7,2017
390866,The Complete Web Developer Bootcamp - Beginner to Expert,Pago,190,14103,1548,197,All Levels,21.5,2015-01-19,Web Development,English,4.4,2015
1014776,Full-Stack Web Apps with Meteor and React,Pago,85,3295,531,162,All Levels,31.5,2016-11-23,Web Development,English,4.23,2016
929130,Angular 4: From Theory to Practice & FREE E-Book,Pago,200,4375,622,129,Intermediate Level,15.5,2016-11-15,Web Development,English,4.7,2016
746014,The Complete Sass & SCSS Course: From Beginner to Advanced,Pago,195,12021,660,41,All Levels,4.0,2016-02-24,Web Development,English,4.3,2016
11475,Become a Certified Web Developer,Pago,100,26673,1090,185,All Levels,12.0,2011-12-20,Web Development,English,4.5,2011
11174,Become a Web Developer from Scratch,Pago,120,69186,2408,197,All Levels,27.5,2011-11-19,Web Development,English,4.23,2011
945978,Ultimate Angular 4 (previously Angular 2) with Bootstrap 4,Pago,50,11384,1846,80,All Levels,5.5,2016-09-19,Web Development,English,4.23,2016
1019276,The Ultimate Beginner's Guide to Django,Pago,200,2390,497,82,Beginner Level,9.0,2016-12-11,Web Development,English,4.5,2016
1252630,React JS - Mastering Redux,Pago,100,7059,116,58,All Levels,5.0,2017-06-19,Web Development,English,4.3,2017
1000010,Professional Ruby on Rails Developer with Rails 5,Pago,200,3179,214,174,All Levels,20.5,2017-02-19,Web Development,English,4.6,2017
937586,"Ruby on Rails 5 - BDD, RSpec and Capybara",Pago,200,1870,193,145,All Levels,14.5,2016-10-28,Web Development,English,4.0,2016
79154,Back to School Web Development and Programming Bundle,Pago,200,18170,117,779,Beginner Level,44.5,2013-08-19,Web Development,English,4.4,2013
328476,Complete ASP NET MVC Web Development - Newbie to Ninja!,Pago,195,6073,627,66,All Levels,9.0,2014-11-24,Web Development,English,3.8,2014
921474,The Complete DevOps Engineer Course 2.0 - Java & Kubernetes,Pago,195,5335,105,117,All Levels,14.0,2016-08-06,Web Development,English,3.8,2016
82778,All about NodeJS,Pago,50,8755,931,133,All Levels,15.5,2014-12-19,Web Development,English,4.7,2014
907386,How To Create A Wordpress Website 2016 | NEW Divi Theme 3.0!,Pago,40,4144,383,43,Beginner Level,5.5,2016-10-13,Web Development,English,4.23,2016
877124,The Complete jQuery Course - From Beginner to Professional!,Pago,200,6420,134,188,All Levels,22.5,2016-06-20,Web Development,English,4.3,2016
1169378,Build a complete Fiverr clone with Node + Algolia + Paypal,Pago,30,1741,26,87,All Levels,9.0,2017-05-20,Web Development,English,4.0,2017
30240,The Ultimate Web Development Course,Pago,50,9881,329,136,All Levels,12.0,2013-08-25,Web Development,English,4.23,2013
836044,React From The Ground Up,Pago,150,3252,401,62,All Levels,12.5,2016-05-02,Web Development,English,4.0,2016
405818,Javascript for Beginners Learn by Doing Practical Exercises,Pago,100,5089,685,29,All Levels,3.5,2015-01-31,Web Development,English,4.4,2015
665042,8 Beautiful Ruby on Rails Apps in 30 Days & TDD - Immersive ,Pago,100,5962,466,132,All Levels,16.0,2016-03-08,Web Development,English,4.8,2016
1068590,Wordpress Website Mastery 2017,Gratis,0,5181,64,22,Beginner Level,2.5,2017-01-18,Web Development,English,3.9,2017
1203894,How To Make an eCommerce Website With Wordpress 2017,Gratis,0,3493,43,26,Beginner Level,4.5,2017-05-09,Web Development,English,4.23,2017
994634,Mastering ASP.NET MVC 5 From Scratch Using C#,Pago,50,417,65,109,All Levels,13.0,2016-12-01,Web Development,English,4.0,2016
765916,Start Web Development with GIS Map in JavaScript,Pago,60,1599,26,49,All Levels,3.0,2016-02-28,Web Development,English,4.23,2016
128950,Learn to Build Websites using Twitter Bootstrap,Gratis,0,15134,523,12,All Levels,2.5,2014-04-14,Web Development,English,4.4,2014
549064,Web Development Tools the Pros Use: Code Productivity Hacks,Pago,30,2596,11,39,Beginner Level,4.0,2015-10-08,Web Development,English,3.7,2015
400280,WordPress : An Overview,Pago,45,1783,16,15,Beginner Level,0.6,2015-02-02,Web Development,Afrikaans,4.23,2015
382856,Create Startup Landing Page with Viral Marketing Strategies,Gratis,0,12974,120,13,Beginner Level,1.0,2015-01-03,Web Development,English,4.5,2015
958982,JavaScript : JavaScript Awesomeness,Pago,25,785,20,25,Beginner Level,1.0,2016-09-15,Web Development,English,4.1,2016
1113036,Mastering CSS 3.0 Selectors,Gratis,0,4115,63,13,Intermediate Level,2.0,2017-02-22,Web Development,English,4.7,2017
226534,WordPress Backup And Restore Fundamentals,Gratis,0,13242,131,24,Intermediate Level,1.0,2014-06-24,Web Development,English,3.7,2014
738726,Learn HTML and CSS to make a Website,Pago,20,1154,12,71,Beginner Level,6.0,2016-01-28,Web Development,English,4.23,2016
64422,1 Hour HTML,Pago,200,16212,514,20,Beginner Level,1.0,2013-07-09,Web Development,English,4.5,2013
874166,Angular 2 Crash Course with TypeScript,Pago,100,16409,589,74,All Levels,4.0,2016-06-14,Web Development,English,4.8,2016
1197650,Boost your website speed without any coding!,Pago,50,1337,28,12,All Levels,1.0,2017-05-14,Web Development,English,4.4,2017
912946,Professional Rails Code Along,Pago,40,1469,237,120,Intermediate Level,19.0,2016-08-04,Web Development,English,4.1,2016
876544,ASP.NET Web API 2 Hands-On,Pago,20,2660,276,16,All Levels,1.5,2016-06-19,Web Development,English,4.5,2016
1205894,Create a MEAN App by Example - Full Stack Course,Pago,50,421,26,33,Intermediate Level,3.5,2017-05-08,Web Development,English,4.4,2017
19332,The Original Complete Web Developer Course.,Pago,20,31070,742,195,Beginner Level,18.0,2012-10-28,Web Development,English,4.5,2012
863954,Angular 2 From The Ground Up,Pago,30,1737,471,87,All Levels,11.5,2016-06-02,Web Development,English,4.23,2016
789324,Complete Web Development Course + Building 5 Websites!,Pago,200,11492,174,118,All Levels,24.5,2016-03-21,Web Development,English,4.4,2016
1229274,WP Plugin Development - Build your own plugin!,Pago,200,5439,22,24,Beginner Level,4.0,2017-06-13,Web Development,English,3.5,2017
906700,Sass: From Beginner to Advanced,Pago,40,8059,231,39,All Levels,2.0,2016-07-21,Web Development,English,4.23,2016
113706,Build Flat Responsive Website from Scratch - Complete Course,Pago,35,12105,144,54,All Levels,7.5,2013-12-04,Web Development,English,4.23,2013
604044,Wordpress for Beginners - Build a Live Website from Scratch,Pago,20,3877,92,15,Beginner Level,1.5,2015-09-09,Web Development,English,4.23,2015
531290,"Essential JavaScript, jQuery and AngularJS Training",Pago,30,2919,136,70,Intermediate Level,7.0,2015-07-09,Web Development,English,4.2,2015
436210,The Pro Ruby on Rails Starter,Pago,45,2409,90,19,Beginner Level,2.5,2015-03-04,Web Development,English,3.9,2015
617158,Unit Testing AngularJS: Build Bugfree Apps That Always Work!,Pago,25,2083,213,23,All Levels,2.5,2016-01-24,Web Development,English,4.5,2016
1121580,WordPress Blog : Create a WordPress Website for Beginners,Pago,20,2076,8,20,Beginner Level,2.0,2017-02-26,Web Development,English,4.23,2017
782192,Introduction to HTML5 Canvas basics of drawing,Pago,200,2918,16,17,Beginner Level,1.0,2016-03-14,Web Development,English,3.9,2016
978728,"Thoughtful Web Development Course: HTML, Vue.js, PHP, MySQL",Pago,200,842,144,536,All Levels,25.0,2016-10-11,Web Development,English,4.6,2016
65493,Kids Coding - Beginners CSS,Pago,100,7130,30,17,All Levels,1.0,2013-07-25,Web Development,English,4.6,2013
32649,PHP & MySQL - Learn The Easy Way. Master PHP & MySQL Quickly,Pago,50,5549,92,143,All Levels,15.5,2012-12-15,Web Development,English,4.1,2012
1225030,Learning Path: Magento: Master and Test Magento 2 with Ease,Pago,200,155,9,37,Expert Level,6.0,2017-05-26,Web Development,English,4.23,2017
903140,The Complete hapiJS Course - Go From Beginner To Advanced!,Pago,195,1697,64,54,All Levels,6.0,2016-07-13,Web Development,English,4.23,2016
372518,Ruby On Rails For Web Development,Pago,195,2526,185,24,Beginner Level,5.0,2014-12-17,Web Development,English,4.2,2014
1045862,Create eye-catching WordPress website from scratch,Pago,30,2342,15,19,Beginner Level,4.5,2016-12-28,Web Development,English,4.23,2016
99826,Become A Web Developer And Seller - Build Websites With HTML,Pago,200,21730,61,35,Beginner Level,2.5,2013-10-05,Web Development,English,4.23,2013
1236746,WordPress Tips and Tricks,Pago,200,1117,10,37,Intermediate Level,2.5,2017-06-08,Web Development,English,4.23,2017
1110756,HTML Tutorials : HTML Code for Website Creating,Pago,20,2401,15,27,All Levels,3.0,2017-02-22,Web Development,English,4.23,2017
595728,Complete HTML5 and CSS3 Course +1 Start to Finish Project,Pago,200,3887,81,94,All Levels,8.5,2015-09-07,Web Development,English,3.5,2015
1231872,Web Development With HTML CSS BOOTSTRAP JQUERY for Beginners,Pago,35,1156,4,59,Beginner Level,5.0,2017-05-30,Web Development,English,3.8,2017
876850,HTML5 Specialist: Comprehensive HTML5 Training,Pago,100,1385,188,83,All Levels,5.0,2016-06-22,Web Development,English,4.5,2016
113518,CSS and CSS3 For Absolute Beginners,Pago,75,10890,212,33,Beginner Level,5.0,2013-11-01,Web Development,English,4.0,2013
1111552,Build a Complete JQuery Plugin (Image Pop-up Dialog),Pago,20,1126,10,12,All Levels,1.0,2017-02-23,Web Development,English,4.2,2017
834924,How to create HTML Forms,Pago,30,3652,60,7,Beginner Level,0.67,2016-04-29,Web Development,English,3.7,2016
764042,ReactJS and Flux: Learn By Building 10 Projects,Pago,60,1723,258,60,All Levels,11.0,2016-02-18,Web Development,English,3.4,2016
821526,How To Make A Business Website In 1 Day With Wix FAST & EASY,Pago,20,3759,24,25,Beginner Level,4.0,2016-04-18,Web Development,English,3.7,2016
838418,PHP Date and Time Course by Edwin Diaz,Pago,40,1653,53,14,All Levels,1.5,2016-05-03,Web Development,English,4.8,2016
342084,Start Your Own Forum Website in 15 Minutes ,Pago,40,5387,38,15,All Levels,1.0,2015-01-26,Web Development,English,4.23,2015
669536,Hit the ground running with AngularJS with Dion Yang,Pago,100,4563,49,13,All Levels,1.5,2015-11-26,Web Development,English,4.23,2015
511378,Learn CSS Transition and Animation ,Pago,100,3757,28,20,All Levels,1.0,2015-05-27,Web Development,English,4.0,2015
553582,Learn JavaScript from scratch,Pago,20,4193,92,44,Beginner Level,2.5,2015-07-30,Web Development,English,4.23,2015
566920,WordPress for Beginners - Tutorial - From Novice to Know-How,Pago,20,3694,48,39,Beginner Level,4.0,2015-08-28,Web Development,English,4.23,2015
406820,RESTful API with Laravel,Pago,45,1905,228,57,All Levels,6.0,2015-02-05,Web Development,English,4.5,2015
636418,Learn Ruby on Rails for Absolute Beginners,Pago,195,2875,20,36,All Levels,4.5,2015-10-14,Web Development,English,3.6,2015
986442,JavaScript Tutorial,Pago,180,613,93,37,All Levels,4.5,2016-10-17,Web Development,English,1.4,2016
996320,Shopping Cart Website from Scratch Ecommerce,Pago,200,633,39,54,Beginner Level,4.0,2016-11-08,Web Development,English,4.1,2016
936182,Learn By Example: Angular JS,Pago,50,1515,32,60,All Levels,7.0,2016-08-22,Web Development,English,4.3,2016
905850,The Complete front end web developer Bootcamp - 14 projects,Pago,200,900,129,126,All Levels,18.5,2016-08-12,Web Development,English,4.7,2016
547298,WordPress LMS: E-Learning Website Made Easy,Pago,20,2382,22,16,All Levels,1.5,2015-07-08,Web Development,English,4.23,2015
294794,Create An HTML5 Video Player From Scratch,Gratis,0,32260,1005,12,Beginner Level,1.5,2014-09-05,Web Development,English,4.23,2014
615920,In Depth Web Development Made Easy,Pago,25,3249,27,60,All Levels,6.5,2015-10-30,Web Development,English,3.9,2015
955818,Jquery :basics for beginners,Pago,50,1274,34,15,All Levels,0.67,2016-09-12,Web Development,English,4.23,2016
65330,Web Development By Doing: HTML / CSS From Scratch,Gratis,0,72932,2575,21,Beginner Level,1.0,2013-09-25,Web Development,English,4.3,2013
173548,Build Your First Website in 1 Week with HTML5 and CSS3,Gratis,0,120291,5924,30,Beginner Level,3.0,2014-04-08,Web Development,English,4.7,2014
1183094,"ASP.NET Core MVC, Quick and Practical",Pago,20,387,5,30,Intermediate Level,2.5,2017-04-25,Web Development,English,4.23,2017
738360,Better way towards CSS using Less and Sass,Pago,20,2227,44,26,All Levels,1.5,2016-02-16,Web Development,English,3.7,2016
650328,JavaScript Complete for beginners with real world Apps,Pago,120,2652,33,40,All Levels,3.5,2016-02-02,Web Development,English,4.5,2016
69414,Creating a Responsive HTML Email,Pago,20,2520,183,34,All Levels,1.5,2013-08-12,Web Development,English,4.4,2013
500628,Angular 2 Demystified,Pago,20,3150,69,49,All Levels,3.5,2015-05-18,Web Development,English,3.4,2015
384078,Learn HTML Fast and Easy!,Pago,20,4011,24,17,Beginner Level,1.5,2015-08-03,Web Development,English,4.6,2015
451938,How To Setup a Micro-Blog in 3 Easy Steps,Pago,25,6937,22,7,All Levels,1.0,2015-03-20,Web Development,English,4.23,2015
657710,Ruby on Rails for Complete Beginners,Pago,35,4839,129,84,Beginner Level,4.0,2015-11-02,Web Development,English,4.23,2015
977516,Wordpress for Non-Technical People,Pago,150,2346,10,65,Beginner Level,4.5,2016-11-15,Web Development,English,4.23,2016
997750,ASP NET CORE - ANGULAR 2 E-Commerce App,Pago,200,897,129,171,All Levels,13.0,2017-01-13,Web Development,English,3.6,2017
316704,Introductory JavaScript Made Easy Training Tutorial,Pago,20,9381,138,131,Beginner Level,11.0,2014-10-15,Web Development,English,3.5,2014
106178,Become a Heroku Rails Ninja: Expert Level Deployment Tools,Pago,50,7090,52,30,Intermediate Level,8.5,2014-02-15,Web Development,Dutch,4.23,2014
1062686,Complete RESPONSIVE Website Design with HTML5 & CSS3,Pago,20,2204,6,97,Beginner Level,9.0,2017-02-03,Web Development,English,4.23,2017
1082996,Pimcore Developer: Implement a Blog from a Bootstrap Theme,Pago,95,1212,15,39,All Levels,4.5,2017-01-24,Web Development,English,4.23,2017
629044,Inspirational Web Development - A Beginner Approach -,Pago,20,5328,47,28,Beginner Level,3.5,2016-01-24,Web Development,English,4.23,2016
476408,"Learn HTML, A practical guide from scratch to HTML 5",Pago,100,5715,52,31,All Levels,3.0,2015-04-26,Web Development,English,4.23,2015
1124244,JavaScript Tutorial: Learn JavaScript Code for Beginners,Pago,20,2074,14,22,Beginner Level,1.5,2017-03-08,Web Development,English,4.23,2017
217010,Website Secrets: Get a Gorgeous Website on the Cheap,Pago,50,12328,15,32,All Levels,2.0,2014-07-04,Web Development,English,4.23,2014
576694,Ultimate WordPress Plugin Course,Pago,100,4537,415,49,All Levels,9.0,2015-08-20,Web Development,English,4.23,2015
527952,PHP for Beginners: How to Build an E-Commerce Store,Pago,100,5117,463,138,All Levels,14.5,2015-07-17,Web Development,English,4.7,2015
745306,"Build Realtime Apps | React Js, Golang & RethinkDB",Pago,60,3854,482,48,All Levels,3.0,2016-01-29,Web Development,English,4.3,2016
941998,"Master Electron: Desktop Apps using HTML, JavaScript & CSS",Pago,165,1902,224,47,Intermediate Level,5.5,2017-03-21,Web Development,English,4.7,2017
674608,The Complete Web Developer Masterclass: Beginner To Advanced,Pago,195,37141,1813,316,All Levels,51.0,2016-05-18,Web Development,English,4.1,2016
1204208,Mastering Micro Services Using Java Spring Boot,Pago,195,1649,34,25,All Levels,2.0,2017-05-17,Web Development,English,4.23,2017
957422,How to Create A Website: An HTML Tutorial and CSS Tutorial,Pago,65,3012,260,330,All Levels,32.5,2016-09-25,Web Development,English,4.6,2016
511838,The Advanced Web Developer Course,Pago,100,6890,99,90,Intermediate Level,10.5,2015-06-03,Web Development,English,4.23,2015
621022,Projects in MongoDB - Learn MongoDB Building Projects,Pago,50,4628,247,93,All Levels,12.0,2015-09-28,Web Development,English,4.5,2015
30318,Learning JavaScript Programming Tutorial. A Definitive Guide,Pago,50,17113,380,93,All Levels,9.5,2012-11-26,Web Development,English,4.5,2012
1270392,"The Complete JavaScript, HTML and CSS Tutorial For Beginners",Pago,35,244,44,21,Beginner Level,3.0,2017-06-29,Web Development,English,4.23,2017
991094,"Build Modern Responsive Website With HTML5, CSS3 & Bootstrap",Pago,195,1472,210,110,All Levels,13.0,2017-02-08,Web Development,English,4.2,2017
695656,The Complete JavaScript Course For Web Development Beginners,Pago,195,31499,450,46,All Levels,4.0,2015-12-29,Web Development,English,4.3,2015
1174446,Email Marketing: Send Unlimited Emails via Own Mail Server,Pago,35,3539,43,20,Beginner Level,1.0,2017-04-19,Web Development,English,4.5,2017
1267892,Getting started with JavaScript,Pago,200,1415,17,23,Beginner Level,1.5,2017-06-27,Web Development,English,4.1,2017
1149334,Learn the basics of the Web development: Coding Tactics,Pago,40,2965,17,30,Beginner Level,2.0,2017-04-29,Web Development,English,4.23,2017
1109150,RESTful API with Laravel 5.4: Definitive Guide,Pago,145,655,95,195,All Levels,12.5,2017-04-28,Web Development,English,4.5,2017
445534,Learn AngularJS Step By Step,Pago,20,18777,1112,21,Intermediate Level,1.5,2015-07-07,Web Development,English,3.9,2015
987666,Learn React : The World's Most Lucrative JavaScript Library,Pago,50,1591,99,74,Beginner Level,9.5,2017-02-08,Web Development,English,4.23,2017
1134330,Master Regular Expressions from scratch - All languages,Pago,70,1925,27,38,All Levels,2.0,2017-04-27,Web Development,English,4.5,2017
983534,Try AngularJS: Beginner's Guide to Front End Web Development,Pago,50,16926,126,33,Beginner Level,4.5,2016-10-13,Web Development,English,4.8,2016
563248,JavaScript Step by Step how to apply it to your web pages,Pago,100,13406,78,44,All Levels,1.5,2015-07-26,Web Development,English,4.4,2015
1140532,Explore JavaScript Beginners Guide to Coding JavaScript,Pago,200,5739,26,29,Beginner Level,2.5,2017-03-12,Web Development,English,4.23,2017
701636,Learn Web Scraping with Node.js,Pago,75,16731,137,10,All Levels,1.0,2015-12-29,Web Development,English,4.0,2015
797832,Getting Started with WordPress 2016,Pago,20,1613,21,20,Beginner Level,1.0,2016-04-14,Web Development,English,4.23,2016
41295,Learn HTML5 Programming From Scratch,Gratis,0,268923,8629,45,All Levels,10.5,2013-02-14,Web Development,English,4.3,2013
413494,Getting Started with LESS - Beginner Crash Course,Pago,25,1780,69,21,Beginner Level,1.5,2015-02-12,Web Development,English,4.2,2015
911318,Master ECMAScript 2015 (ES6),Gratis,0,7438,441,37,All Levels,2.5,2016-11-28,Web Development,English,4.7,2016
197828,Learn to Setup Websites from Scratch,Gratis,0,21087,154,24,Beginner Level,3.5,2014-04-14,Web Development,English,4.6,2014
576646,Create Fast RESTful APIs with Lumen and Homestead by Laravel,Pago,60,1157,105,31,All Levels,3.0,2015-10-25,Web Development,English,4.23,2015
984072,"Build Modern Websites Quick With HTML,CSS and Bootstrap",Pago,20,912,17,48,Beginner Level,4.5,2016-10-18,Web Development,English,4.23,2016
709180,Twitter Integration customize Tweets with developer API,Pago,115,2039,7,19,All Levels,1.0,2015-12-29,Web Development,English,4.1,2015
188692,Build a Responsive Website with a Modern Flat Design,Gratis,0,16527,354,17,All Levels,2.0,2014-03-26,Web Development,English,4.23,2014
683606,The Ultimate WordPress Boot Camp: Build 7 Websites,Pago,125,1000,74,140,Intermediate Level,11.0,2016-02-26,Web Development,English,4.23,2016
429364,Master the Basics of HTML5 & CSS3: Beginner Web Development,Gratis,0,26541,750,38,Beginner Level,3.0,2015-05-21,Web Development,English,4.5,2015
1012096,Become A Full Stack Web Developer in 14 Days,Pago,195,467,20,126,All Levels,13.5,2016-11-23,Web Development,English,4.3,2016
1016388,Projects In ReactJS - The Complete React Learning Course,Pago,50,947,108,56,Intermediate Level,8.0,2016-11-22,Web Development,English,4.23,2016
978852,Beginning Web development Learn the basics of HTML,Pago,95,9832,71,59,Beginner Level,2.0,2017-01-06,Web Development,English,4.5,2017
1148342,Step by Step Build Your Template by Bootstrap 4 from scratch,Pago,80,2184,15,24,Beginner Level,3.0,2017-03-30,Web Development,English,4.23,2017
1199780,Hosting your static website on Amazon AWS S3 service,Pago,20,2853,47,16,Beginner Level,1.5,2017-05-05,Web Development,English,4.4,2017
648118,JavaScript Rockstar How to create Incredible Useful code,Pago,75,16590,51,27,All Levels,2.5,2015-10-29,Web Development,English,4.0,2015
863812,Spring Core DevOps on AWS,Pago,100,1626,115,78,Intermediate Level,6.5,2016-11-15,Web Development,English,4.6,2016
752432,How to Create a Website Without Coding - WordPress 2016,Pago,195,9056,96,31,Beginner Level,1.5,2016-02-04,Web Development,English,4.2,2016
639848,PHP Graphic Techniques: CAPTCHA/ Create a verification code,Pago,20,8320,73,11,All Levels,0.72,2015-10-14,Web Development,English,4.23,2015
942366,Introductory To HTML and CSS,Pago,50,4106,112,15,Beginner Level,1.0,2016-08-27,Web Development,English,4.23,2016
1103448,Learn how to convert PSD to HTML and CSS responsive,Pago,30,5324,52,14,All Levels,2.5,2017-02-10,Web Development,English,3.6,2017
945602,PHP User Login Registration Script With All Features,Pago,200,5603,46,47,All Levels,4.0,2016-10-02,Web Development,English,3.5,2016
446608,AJAX : Let's build a COOL project,Pago,70,4183,292,38,All Levels,3.5,2015-03-13,Web Development,English,4.7,2015
866384,Advanced WordPress Topics: Post Types Taxonomies & Metaboxes,Pago,95,301,44,91,Intermediate Level,7.5,2016-07-10,Web Development,English,3.9,2016
678150,Laravel Homestead,Gratis,0,3883,110,9,Beginner Level,1.0,2016-12-07,Web Development,English,4.7,2016
980114,The Complete TypeScript Programming Guide for Web Developers,Pago,40,236,31,35,Intermediate Level,4.0,2016-10-12,Web Development,English,4.2,2016
17887,JavaScript with BackboneJS and Bootstrap CSS - Advanced,Pago,25,1758,37,16,Intermediate Level,3.5,2012-05-21,Web Development,English,4.23,2012
465210,Ruby on Rails Tutorial: Learn 6 Ruby on Rails SEO Techniques,Pago,200,1266,16,21,All Levels,2.0,2015-05-15,Web Development,English,3.7,2015
967422,XML DOM :basics for beginners,Pago,35,920,1,7,All Levels,0.7,2016-09-26,Web Development,English,4.23,2016
708558,Learn HTML Basics From Scratch,Gratis,0,5004,52,21,All Levels,3.0,2015-12-29,Web Development,English,4.23,2015
783686,Byte-Sized-Chunks: Dynamic Prototypes in Javascript,Pago,20,880,6,24,All Levels,3.0,2016-03-10,Web Development,English,4.23,2016
