course_id,course_title,is_paid,price,num_subscribers,num_reviews,num_lectures,level,content_duration,published_timestamp,subject,language,rating,year_published
576906,"Technical Analysis Primer for trading Stocks, Bonds & Forex",Pago,50,397,4,36,Beginner Level,3.0,2015-11-23,Business Finance,English,4.5,2015
410196,DIY: Reduce Unpaid Federal Tax thru  IRS Offer in Compromise,Pago,20,44,3,8,All Levels,1.0,2015-03-26,Business Finance,English,4.23,2015
581662,Stock Trading with this Strategy,Pago,50,30,3,6,All Levels,1.0,2015-08-13,Business Finance,English,3.7,2015
1088102,The Psychology of Trading,Pago,20,95,3,20,All Levels,1.0,2017-02-02,Business Finance,English,2.9,2017
788756,Professional Forex Strategy+2 weeks for FREE trading alerts,Pago,95,55,9,15,All Levels,1.0,2016-03-29,Business Finance,English,4.23,2016
380206,Stock Trading Essentials for Day Traders,Pago,100,94,15,9,All Levels,1.0,2015-01-08,Business Finance,English,3.4,2015
160322,Basics of Finance and Budgeting,Pago,20,578,7,34,Beginner Level,6.0,2014-05-19,Business Finance,English,3.4,2014
610812,Portfolio Management CFA L1 2016,Pago,20,393,5,34,All Levels,5.0,2015-09-15,Business Finance,English,4.2,2015
288256,"Trade Stocks, Forex & Financial Markets like a Professional",Pago,20,116,6,12,All Levels,3.0,2014-08-28,Business Finance,English,4.23,2014
662996,The Tax Advantaged Investor: A Guide to Legal Tax Reduction!,Gratis,0,1888,42,25,All Levels,2.0,2015-12-17,Business Finance,English,4.0,2015
101234,The Smart Option Trader,Pago,45,412,19,74,All Levels,13.0,2013-10-10,Business Finance,English,3.6,2013
1113442,Beginners Chart Patterns Trading for Penny Stocks,Pago,200,40,7,26,Beginner Level,1.5,2017-02-22,Business Finance,English,4.4,2017
746366,Financial Statements: Learn Accounting. Unlock the Numbers.,Pago,40,222,12,35,Beginner Level,3.0,2016-02-17,Business Finance,English,4.5,2016
186556,CFA® Level 1 2014 – Alternative Investments,Pago,30,831,1,13,All Levels,2.0,2014-04-14,Business Finance,English,4.23,2014
179500,Interest Rate Swaps,Pago,50,485,24,20,All Levels,3.5,2014-03-11,Business Finance,English,4.5,2014
304000,Financial Modelling for entrepreneurs,Pago,20,232,7,17,All Levels,1.0,2014-09-20,Business Finance,English,3.4,2014
334838,Economics - CFA Level 1 - 2014,Pago,20,135,20,24,Beginner Level,4.0,2014-11-08,Business Finance,Catalan,4.23,2014
302456,Bookkeeping Made Simple,Pago,40,61,16,22,All Levels,2.5,2015-07-16,Business Finance,English,4.5,2015
537748,What is Bitcoin,Pago,20,61,3,27,All Levels,5.0,2015-07-09,Business Finance,English,4.23,2015
378464,Accounting for CA CPT Exams Part I,Pago,50,874,2,120,All Levels,13.5,2014-12-27,Business Finance,English,4.23,2014
532216,Raising Capital for Your Business,Pago,50,22,5,60,All Levels,2.5,2015-08-03,Business Finance,English,4.9,2015
41973,"Silver, Gold, and Inflation",Gratis,0,5597,76,11,Beginner Level,1.0,2013-02-16,Business Finance,English,4.23,2013
138004,Accounting Concepts For Technocrats,Pago,20,261,2,35,Beginner Level,2.5,2013-12-26,Business Finance,English,4.23,2013
94532,Beginner Financial Analysis: Invest Like Warren Buffett,Pago,50,83,4,19,Beginner Level,0.68,2014-03-10,Business Finance,German,4.23,2014
467238,Advance Technical Analysis,Pago,50,152,6,14,Expert Level,3.5,2015-04-08,Business Finance,English,4.23,2015
850294,The Everyday Investor: Building Wealth with Venture Capital,Pago,20,176,2,12,Intermediate Level,2.5,2016-06-07,Business Finance,English,4.23,2016
1110256,QuickBooks Online : Inventory Management For Non-Finance,Pago,35,8,4,10,All Levels,0.67,2017-04-20,Business Finance,English,4.23,2017
439210,Law Matters,Pago,20,327,1,12,Beginner Level,0.45,2015-03-27,Business Finance,German,4.23,2015
597164,Learn to Trade for Profit: Finding Winning Stocks - Chinese,Pago,95,264,0,79,All Levels,3.0,2015-10-08,Business Finance,English,4.9,2015
773502,Financial Accounting Part 2 - Passing The Class,Pago,20,15,4,36,Beginner Level,4.5,2017-05-01,Business Finance,English,4.5,2017
262818,Simple Options Trading System,Pago,35,104,2,16,Intermediate Level,1.5,2014-07-31,Business Finance,English,4.4,2014
255046,Investments and Financial Markets,Pago,40,71,3,19,Beginner Level,1.5,2014-07-22,Business Finance,English,4.23,2014
295909,Legal Accounting,Pago,110,26,6,49,All Levels,4.0,2014-09-21,Business Finance,English,3.5,2014
1153876,"Term Loan Appraisal for bankers, credit analysts",Pago,20,11,2,28,Beginner Level,6.5,2017-04-03,Business Finance,English,4.23,2017
83736,Small Biz Doers' Guide to Small Biz Accounting + Bookkeeping,Pago,20,1294,7,58,Beginner Level,5.5,2013-08-28,Business Finance,English,4.23,2013
75182,Trade Show Samurai,Pago,95,32,7,7,All Levels,0.52,2013-08-29,Business Finance,English,4.5,2013
236070,Forex Harmonic Trading- With Multiple Forex Chart Examples,Pago,135,313,16,25,All Levels,2.5,2016-11-28,Business Finance,English,4.23,2016
788796,The Cost of Capital: The Key To Attract Venture Capitalists,Pago,50,635,4,6,All Levels,0.68,2016-03-22,Business Finance,English,4.23,2016
508796,Accounting for School Students,Pago,30,1311,2,12,All Levels,1.5,2015-05-22,Business Finance,English,4.23,2015
739910,Learn To Trade The Forex Naked Price Action Acapulco Trade,Pago,70,288,9,13,Intermediate Level,1.0,2016-01-25,Business Finance,English,4.23,2016
725872,Certificate in MYOB AccountRight Premier 2017 Course,Pago,200,97,18,29,All Levels,3.0,2016-03-10,Business Finance,English,4.0,2016
894336,Master The Psychology of Forex & Binary Options Trading,Pago,20,53,16,7,Intermediate Level,1.0,2016-07-04,Business Finance,English,4.4,2016
334820,Learn to Pick the Right Stock Broker Account,Pago,40,1102,3,14,Beginner Level,0.57,2014-12-24,Business Finance,English,4.23,2014
619786,Profit During Crashing Markets: A Step-by-Step Guide,Pago,195,57,11,18,All Levels,1.0,2016-05-16,Business Finance,English,4.23,2016
179820,Introduction to Futures & Options,Pago,50,694,35,27,All Levels,4.5,2014-03-11,Business Finance,English,4.5,2014
322332,Learn To Invest In 7 Steps,Pago,50,137,14,21,Beginner Level,3.0,2015-03-29,Business Finance,English,4.23,2015
597424,Sell like a Pro: Insider Secrets of Successful Selling!,Pago,115,12,1,25,All Levels,2.5,2016-11-01,Business Finance,English,4.23,2016
1089610,3 Little Pigs: A Multiple Timeframe Forex Trading Strategy,Pago,20,18,0,6,All Levels,1.5,2017-02-24,Business Finance,English,4.23,2017
166842,6. Annuities Due and Deferred,Pago,20,170,0,16,All Levels,1.5,2014-02-24,Business Finance,English,4.23,2014
408232,CFA® Level 1 2014 – Quantitative Methods,Pago,50,119,0,27,All Levels,5.0,2015-02-26,Business Finance,English,4.23,2015
249376,IFRIC 13-Customer Loyalty Programmes (Revenue),Gratis,0,2058,22,6,All Levels,0.6,2014-07-05,Business Finance,English,4.23,2014
231256,FOREX Currency Trading For Beginners,Pago,25,35,2,28,Beginner Level,4.0,2014-06-17,Business Finance,English,4.7,2014
479496,Basic Technical Analysis,Pago,50,40,1,27,Beginner Level,2.5,2015-08-05,Business Finance,English,4.23,2015
944534,Forex:Trade Management & Psychology,Pago,150,13,0,19,Intermediate Level,2.0,2016-09-21,Business Finance,English,4.1,2016
1153854,"Working Capital assessment for bankers, credit analysts",Pago,20,4,0,29,Beginner Level,7.0,2017-04-06,Business Finance,English,4.23,2017
74028,"CFA Level I Workshop 6: Alternatives, PM and Economics ",Pago,20,71,1,5,All Levels,1.0,2013-08-12,Business Finance,English,4.23,2013
73962,CFA Level I Workshop 3: Financial Reporting & Analysis II,Pago,20,71,1,5,All Levels,1.0,2013-08-12,Business Finance,English,4.23,2013
1156530,How to trade in the Forex market,Pago,200,6,0,39,Intermediate Level,2.5,2017-03-29,Business Finance,English,4.23,2017
1097288,Bookkeeping Practicals with Software,Pago,35,1,0,130,Intermediate Level,31.5,2017-02-07,Business Finance,English,4.23,2017
614668,8 Steps To Achieve Financial Freedom And Escape Debt,Pago,40,5,0,48,Beginner Level,5.5,2015-11-13,Business Finance,English,4.23,2015
1082352,Trading Basics in 30 minutes,Pago,50,1,0,6,Beginner Level,0.53,2017-02-26,Business Finance,English,4.23,2017
625670,Technical Charting,Pago,20,4,1,6,Intermediate Level,1.0,2015-11-02,Business Finance,English,4.23,2015
35409,Profits Turbo,Pago,20,10,0,7,Intermediate Level,5.5,2013-06-03,Business Finance,English,4.23,2013
250902,Nest Egg Investing,Pago,45,6,0,12,Beginner Level,2.0,2014-06-27,Business Finance,Norwegian,4.23,2014
1010988,Economics for beginners - Various Concepts,Pago,25,2,0,34,Beginner Level,2.5,2017-01-02,Business Finance,English,4.23,2017
855816,Investing in Stocks & Shares,Pago,20,2,0,24,Beginner Level,2.0,2016-05-23,Business Finance,English,4.1,2016
813360,Learn Financial Modeling from Scratch - Part 2,Pago,50,2,1,27,All Levels,3.5,2016-04-07,Business Finance,English,4.23,2016
813516,Learn Financial Modeling from Scratch - Part 3,Pago,50,2,0,22,All Levels,2.0,2016-04-07,Business Finance,English,5.0,2016
302484,A Practical Guide to Wealth Creation,Pago,35,6,0,7,All Levels,1.0,2016-11-18,Business Finance,English,4.8,2016
861764,"'Geometry Of Chance strategy of defeating the roulette.""",Pago,30,2,1,10,Intermediate Level,1.5,2016-06-28,Business Finance,English,4.6,2016
765238,Trading Algorítmico en Forex: Crea tu primer Robot de Forex!,Pago,170,206,39,39,All Levels,6.5,2016-03-12,Business Finance,Catalan,4.23,2016
542950,MQL4 Bootcamp Tutorial- Trading Robot Coding in Metatrader4,Pago,20,313,14,25,Beginner Level,1.0,2015-07-05,Business Finance,English,4.23,2015
307080,Introducción a la contabilidad,Pago,20,193,19,14,Beginner Level,1.0,2014-12-17,Business Finance,Spanish,3.9,2014
469848,Einnahmen aus Udemy-Kursen als Dozent korrekt versteuern,Pago,30,66,16,11,Beginner Level,1.0,2015-04-09,Business Finance,German,3.9,2015
581498,Contabilidad Gubernamental en México,Pago,30,270,22,24,All Levels,3.5,2015-08-14,Business Finance,Spanish,4.6,2015
849896,株式投資に必要なスキルの学習手順を学ぶ,Pago,20,139,36,29,Beginner Level,2.0,2016-06-09,Business Finance,Japanese,4.1,2016
1174084,Formação de preços em serviços,Pago,35,77,5,28,Intermediate Level,2.0,2017-04-26,Business Finance,Portuguese,4.0,2017
801702,"Geld verdienen mit dem Ticken der Uhr, wie Warren Buffett!",Pago,195,225,41,33,All Levels,5.0,2016-03-30,Business Finance,German,4.23,2016
786984,Торговля дельта-нейтральными стренглами,Pago,150,23,6,25,All Levels,1.5,2016-03-10,Business Finance,Russian,4.4,2016
255592,Guía práctica para comprar acciones en la Bolsa de USA,Gratis,0,4876,210,36,Intermediate Level,4.5,2014-09-11,Business Finance,Spanish,4.3,2014
514844,Contabilidad Financiera: Conoce el Lenguaje de los Negocios.,Pago,20,244,13,21,Beginner Level,2.5,2015-06-16,Business Finance,Spanish,4.23,2015
998706,Curso de Day Trader para Iniciantes,Gratis,0,1278,200,13,Beginner Level,1.5,2016-11-03,Business Finance,Spanish,4.23,2016
644020,Curso de Iniciación al Trading,Pago,85,31,5,40,All Levels,10.5,2015-11-26,Business Finance,Spanish,4.23,2015
1250742,Complete GST Course For Small and Medium Enterprises,Pago,75,8,0,45,Beginner Level,6.0,2017-06-14,Business Finance,English,4.23,2017
54246,3 documentos clave para administrar tu empresa con éxito,Pago,45,40,6,18,Intermediate Level,1.0,2013-05-16,Business Finance,Spanish,4.2,2013
805630,Forex/Opciones Binarias para Principiantes,Pago,25,9,5,9,Beginner Level,2.0,2016-04-01,Business Finance,Spanish,4.23,2016
315716,15 Mandamientos para ganar dinero en Bolsa,Pago,20,45,2,49,All Levels,8.5,2014-10-14,Business Finance,Spanish,4.23,2014
1124276,Le bitcoin et la blockchain,Pago,80,13,3,12,All Levels,0.73,2017-03-13,Business Finance,French,3.3,2017
1227792,Contabilità Generale,Pago,200,4,1,40,All Levels,8.5,2017-05-29,Business Finance,Italian,4.23,2017
769340,Торговля опционами: Как заработать на волатильности,Pago,150,20,5,29,All Levels,2.0,2016-02-25,Business Finance,Russian,4.2,2016
737182,Estrategias de Inversión aplicadas al mundo del trading,Pago,20,9,2,25,All Levels,3.0,2016-05-26,Business Finance,Spanish,3.6,2016
960786,バイナリーオプション取引,Pago,85,29,3,24,All Levels,0.65,2016-11-28,Business Finance,Japanese,2.4,2016
657050,Caza los Enormes Movimientos del Mercado,Pago,20,6,2,13,All Levels,1.5,2015-11-12,Business Finance,Spanish,4.23,2015
1196700,Le basi del trading online,Pago,45,7,1,27,Beginner Level,3.5,2017-05-31,Business Finance,Italian,3.7,2017
1137310,自分に合った投資信託を見つけよう！,Pago,25,859,49,23,Beginner Level,2.0,2017-03-31,Business Finance,Japanese,4.4,2017
632368,Monatlich Geld anlegen für später!,Pago,30,5983,135,7,Beginner Level,0.62,2015-10-06,Business Finance,German,4.1,2015
571730,Invierte en la Bolsa Mexicana y de USA,Pago,200,1673,547,40,Beginner Level,5.5,2015-08-10,Business Finance,Spanish,4.7,2015
720994,Gestão Financeira Para Pequenas e Médias Empresas,Pago,115,1284,230,45,All Levels,4.5,2016-01-29,Business Finance,Portuguese,4.6,2016
1080466,Curso Completo de Bitcoin - Ganhe 0.00005 Bitcoin,Pago,30,394,109,73,All Levels,5.5,2017-02-06,Business Finance,English,4.23,2017
907416,Tudo sobre Investimentos em Renda Fixa,Pago,45,689,145,16,All Levels,2.0,2016-08-22,Business Finance,Portuguese,4.3,2016
1062144,Aprende a invertir sin capital,Pago,130,649,37,29,Beginner Level,1.5,2017-05-01,Business Finance,Spanish,4.4,2017
1097486,Apprendre à trader sur le marché du Forex - guide complet,Pago,140,187,47,38,Beginner Level,3.0,2017-03-07,Business Finance,French,4.6,2017
396890,Introducción a las Finanzas,Pago,30,1798,40,15,Beginner Level,1.5,2015-01-27,Business Finance,Spanish,3.7,2015
945194,Finanzielle Unabhängigkeit-1: Erste Schritte zur Million,Pago,20,465,51,28,Beginner Level,1.0,2016-09-12,Business Finance,German,4.0,2016
598846,Forex para Principiantes-Ejemplos en VIVO de Trading Real,Pago,140,813,94,52,Beginner Level,5.0,2015-10-05,Business Finance,Spanish,4.23,2015
950750,Finanzielle Unabhängigkeit-3 Millionär werden mit Immobilien,Pago,20,326,23,14,Expert Level,1.0,2016-09-12,Business Finance,German,3.8,2016
740764,Introduction to Health Financing,Pago,85,26,1,17,Beginner Level,2.0,2016-05-17,Business Finance,English,4.23,2016
739972,Accounting Cycle: Learn the concepts in 60 minutes,Pago,20,26,3,14,All Levels,1.0,2016-01-26,Business Finance,English,4.23,2016
464002,Optimize! Make Best Decisions with Microsoft Excel,Pago,20,28,3,14,Expert Level,1.0,2015-04-01,Business Finance,English,4.23,2015
343818,Understanding The Stock Market: For Beginners,Pago,25,122,2,36,Beginner Level,7.5,2014-11-18,Business Finance,English,4.2,2014
434100,CFA® Level 1 2014 – FI,Pago,40,149,0,49,All Levels,4.5,2015-03-08,Business Finance,Dutch,4.23,2015
158140,9. Sinking Funds,Pago,20,205,1,5,All Levels,1.0,2014-02-11,Business Finance,German,4.23,2014
1141708,Managerial Accounting - The Ultimate Beginner Course!,Pago,100,11,0,121,Beginner Level,11.0,2017-04-13,Business Finance,English,4.1,2017
1240408,Forex Trading for Beginners Vol 1:A Forex Course Made Simple,Pago,175,3,0,27,Beginner Level,1.0,2017-07-04,Business Finance,English,4.0,2017
557208,Accounting - Basic Costing ,Pago,40,108,2,37,Beginner Level,3.5,2015-08-04,Business Finance,English,4.2,2015
1178150,"Double Your Salary With Free, Local, Job Training Courses",Pago,20,8,1,8,All Levels,1.0,2017-04-17,Business Finance,English,4.3,2017
93850,Financial Modeling - Facebook Case Study,Pago,25,9,3,13,All Levels,1.5,2013-10-02,Business Finance,English,4.23,2013
429080,Understanding Financial Derivatives,Pago,20,16,1,11,Intermediate Level,2.0,2017-03-24,Business Finance,English,4.0,2017
914164,Forex Basics: Learn how to read and analyze Forex charts,Pago,195,11,0,45,Beginner Level,4.5,2016-09-22,Business Finance,English,4.23,2016
876898,Forex - Help I cant Trade,Pago,200,12,0,20,All Levels,2.0,2016-10-18,Business Finance,English,3.5,2016
877968,Start-up financial modeling for non-finance professionals,Pago,20,11,0,19,All Levels,4.0,2016-06-20,Business Finance,English,4.1,2016
1230950,The Fast Route to a Faster Financial Close,Pago,50,2,0,8,Intermediate Level,1.5,2017-06-23,Business Finance,English,4.23,2017
953432,Easy Finance For Startups,Pago,50,9,4,6,Beginner Level,0.67,2016-10-16,Business Finance,English,4.23,2016
872204,"Excel 4 Accounting & Bookkeeping - Master Date,Time & Text",Pago,35,15,1,12,All Levels,1.0,2016-06-27,Business Finance,English,4.23,2016
1027678,"Depreciation, Amortization and Depletion",Pago,25,7,1,13,Intermediate Level,1.0,2017-03-06,Business Finance,English,3.9,2017
304420,Breakeven Analysis and Pricing,Pago,20,27,2,10,All Levels,1.0,2014-09-22,Business Finance,English,3.1,2014
1078254,Tally ERP Complete Training in Urdu / Hindi,Pago,30,5,2,51,All Levels,5.0,2017-02-02,Business Finance,Hindi,3.6,2017
1193288,Accounting Simplified,Pago,30,3,0,41,All Levels,8.5,2017-05-03,Business Finance,English,4.23,2017
1106148,Series 7: Intermediate Options,Pago,55,5,0,11,Intermediate Level,1.0,2017-04-17,Business Finance,English,4.7,2017
1029322,Accounting and Business Basics,Pago,200,5,0,10,All Levels,2.0,2017-01-19,Business Finance,English,4.23,2017
676650,Corso introduttivo al trading profittevole,Pago,20,132,9,9,Beginner Level,1.0,2015-11-23,Business Finance,Italian,4.23,2015
129274,Aprende a Ganar Dinero en la Bolsa,Pago,30,112,16,42,All Levels,4.0,2013-12-11,Business Finance,Spanish,4.23,2013
634932,Inversión: Fundamentos del Trading para Principiantes,Pago,125,285,6,18,Beginner Level,1.5,2015-10-26,Business Finance,Spanish,3.7,2015
116924,Gana en la Bolsa con Análisis Técnico,Pago,25,91,11,35,Beginner Level,8.5,2014-01-29,Business Finance,Spanish,4.23,2014
1174086,Precificação - Calculando valor de venda baseado nos custos,Pago,35,32,3,46,All Levels,3.0,2017-04-19,Business Finance,Portuguese,4.3,2017
369726,Cómo ganar dinero invirtiendo en bolsa,Gratis,0,2740,306,10,Beginner Level,2.0,2016-04-02,Business Finance,Spanish,4.8,2016
427040,Investiere in Tax Liens-Hohe Zinsen gesetzl. festgeschrieben,Pago,20,59,11,7,All Levels,1.5,2015-02-25,Business Finance,German,4.23,2015
1132162,Investimento em Ações,Pago,20,16,4,27,Beginner Level,4.5,2017-03-27,Business Finance,Portuguese,4.2,2017
1206414,Excelを使ってビジネスシミュレーション：基礎編,Pago,85,22,5,47,Beginner Level,5.0,2017-05-18,Business Finance,Japanese,4.5,2017
997128,Estrategias de trading en bolsa,Pago,25,15,2,14,All Levels,2.0,2016-12-10,Business Finance,Spanish,3.9,2016
826168,Grundlagen der finanziellen Unabhängigkeit,Gratis,0,1059,96,9,All Levels,1.5,2016-04-21,Business Finance,German,3.9,2016
1039930,"Wie Du, Dir auch mit kleinen Beträgen ein Vermögen aufbaust",Pago,70,187,3,53,All Levels,7.0,2016-12-14,Business Finance,German,4.23,2016
1232390,Corporate Ethics,Pago,100,0,0,13,Beginner Level,3.5,2017-07-03,Business Finance,English,4.23,2017
1232312,Core Financial Statement Concepts,Pago,50,0,0,9,Intermediate Level,1.5,2017-06-28,Business Finance,English,3.8,2017
1251654,Understand Core Finance Principles in 60 Minutes,Pago,75,0,0,13,Beginner Level,2.5,2017-06-29,Business Finance,English,4.0,2017
712994,Learn Wave accounting to maintain books properly,Gratis,0,1089,50,27,All Levels,3.0,2016-01-13,Business Finance,English,4.1,2016
1024862,Making Tax Digital - UK HMRC Legislation Explained,Gratis,0,743,0,7,All Levels,1.0,2017-06-06,Business Finance,English,4.0,2017
123242,Surviving Introduction to Finance,Gratis,0,1362,7,13,Beginner Level,3.0,2014-02-06,Business Finance,English,4.2,2014
788720,Cost of Capital and Weighted Average Cost of Capital,Gratis,0,405,3,22,All Levels,1.0,2016-04-11,Business Finance,English,4.23,2016
196164,Studying the CFA Program exams (Mandarin language version),Gratis,0,1168,9,5,All Levels,0.67,2014-04-09,Business Finance,English,4.23,2014
1268616,Condor Broken Wing Butterfly Options Trading Course System,Gratis,0,16,0,15,All Levels,1.5,2017-07-06,Business Finance,English,4.2,2017
1100746,≪虎の巻≫証券取引の「税金のお悩み」解消,Pago,25,3840,296,33,Intermediate Level,1.5,2017-02-21,Business Finance,Japanese,4.1,2017
1005312,【１日でマスター！】今日からはじめる資産形成,Pago,20,7183,819,14,Beginner Level,1.0,2017-01-19,Business Finance,Japanese,4.0,2017
624016,TRADING FOR A LIVING: Trading Full-Time Transition Guide,Pago,195,483,10,40,Intermediate Level,3.5,2015-11-06,Business Finance,English,3.4,2015
323916,Learn How To use Channels to find amazing Forex Entries,Pago,45,172,48,15,All Levels,1.0,2017-05-24,Business Finance,English,4.6,2017
743568,"Financial Analysis, from Scratch to Professional!",Pago,65,256,29,39,Beginner Level,3.5,2016-03-06,Business Finance,English,4.4,2016
479688,Cost Accounting Labour Costing (Professional Course Level),Pago,20,1542,1,24,All Levels,2.0,2015-04-20,Business Finance,English,4.23,2015
1189592,Learn How To Successfully Trade Forex: In 5 Simple Steps,Pago,95,64,7,44,All Levels,8.5,2017-05-03,Business Finance,English,4.4,2017
578534,The Intelligent Investor,Pago,30,384,40,44,All Levels,10.5,2015-08-27,Business Finance,English,4.1,2015
791574,Succeed in Futures Even if You Don't Know Where to Start,Gratis,0,3014,19,15,All Levels,1.0,2017-01-03,Business Finance,English,4.1,2017
379196,Binary Options Beginners Guide : Nadex,Pago,40,454,52,39,Beginner Level,2.0,2015-01-09,Business Finance,English,4.2,2015
331968,Trading: From Wall Street to Your Street,Pago,50,312,24,37,Intermediate Level,5.5,2014-12-18,Business Finance,English,3.6,2014
576636,Build your own Naked Trading Forex Robot,Pago,40,315,28,19,All Levels,2.0,2015-08-11,Business Finance,English,4.2,2015
724596,Tax Preparation: Learn Fast! Prepare Taxes with Confidence!,Pago,200,609,32,33,All Levels,2.5,2016-01-12,Business Finance,English,4.4,2016
822808,Tax Strategies of the Wealthy,Pago,195,207,19,11,Beginner Level,1.5,2016-04-29,Business Finance,English,4.3,2016
932274,The Ultimate Fibonacci Trading Plan for Forex and Stocks,Pago,200,399,15,15,All Levels,1.0,2016-08-19,Business Finance,English,4.23,2016
32908,Finance and Accounting for Startups,Pago,50,1175,92,75,All Levels,12.5,2013-01-15,Business Finance,English,4.3,2013
883394,Forex - Calculate Lot Size Like Pro,Pago,20,543,14,11,All Levels,0.6,2016-06-21,Business Finance,Romanian,4.23,2016
20185,The Complete Forex Trader,Pago,25,1634,142,46,All Levels,7.0,2012-10-01,Business Finance,English,4.6,2012
188418,Tape Reading: Learn how to read the tape for day trading,Pago,195,1013,128,32,All Levels,14.0,2014-03-27,Business Finance,English,3.8,2014
975982,4 Easy Daily Forex Trades: A Recipe for Trading Success,Pago,200,319,19,12,All Levels,1.0,2016-11-17,Business Finance,English,4.23,2016
674352,Trading Robot Forex Programs in Your Sleep in Live Examples!,Pago,200,1125,11,18,Expert Level,1.5,2016-01-28,Business Finance,English,3.7,2016
936884,Free Options 101 - Basic of Call and Put Options in 1 Hours,Gratis,0,2481,71,26,All Levels,1.5,2016-08-22,Business Finance,English,4.2,2016
707644,An Intro into Trading the Financial Markets,Pago,100,1006,14,17,Beginner Level,1.5,2016-09-03,Business Finance,English,4.23,2016
700140,Developing A Trading Strategy: Your Guide to Trading Success,Pago,20,1044,8,16,All Levels,2.0,2015-12-17,Business Finance,English,4.23,2015
546656,How to Trade Commodity and Financial Futures for a Living!,Pago,200,1240,17,20,All Levels,2.5,2016-01-15,Business Finance,English,3.8,2016
1041926,How to Trade Forex like a Hedge Fund: Long FX Strategies,Pago,115,504,5,32,All Levels,1.5,2017-03-23,Business Finance,English,4.4,2017
1253868,Complete Short Financial Ratio Course for Financial Analysis,Pago,200,15,1,56,All Levels,3.0,2017-06-28,Business Finance,English,4.23,2017
645634,How to Build Profitable FOREX Automated Trading Strategies!,Pago,200,358,8,21,All Levels,2.5,2015-11-11,Business Finance,English,4.23,2015
528104,Stock Trading Strategies: Profitable Trading in 7 Days.,Pago,50,80,10,27,All Levels,5.5,2015-06-16,Business Finance,English,3.8,2015
1053462,Management Accounting A Complete Study,Pago,150,133,3,158,All Levels,17.5,2016-12-29,Business Finance,English,3.9,2016
148028,Become a Career Day Trader: Asian-Pacific Futures Markets,Pago,20,207,8,30,All Levels,3.5,2014-01-27,Business Finance,English,4.23,2014
179824,Equity Products,Pago,50,426,17,16,All Levels,2.5,2014-03-11,Business Finance,English,4.3,2014
777276,Financial Accounting Part I - Passing the Class,Pago,20,45,10,47,Beginner Level,4.5,2016-06-29,Business Finance,English,4.4,2016
174790,Accounting 102: Guide to Business Accounting,Pago,50,1280,1,27,Intermediate Level,8.5,2014-05-09,Business Finance,English,4.23,2014
247940,Monetizing Your Website: How to Add Cost-Per-Action (CPA) ,Pago,35,142,4,18,All Levels,1.0,2014-06-30,Business Finance,English,4.23,2014
42146,Advanced Finance and Accounting for Startups,Pago,40,188,7,48,Intermediate Level,6.5,2014-02-27,Business Finance,English,4.5,2014
408894,Basics of Tax in India  (College Level),Pago,20,718,5,28,All Levels,2.0,2015-01-31,Business Finance,English,4.23,2015
176136,Trade for a Living,Pago,20,293,14,59,All Levels,8.0,2014-03-22,Business Finance,English,4.23,2014
929146,Learn Stock Options: Options Made Simple 101,Pago,35,93,13,49,Beginner Level,5.0,2016-08-17,Business Finance,English,4.3,2016
260066,Banking Credit Analysis Process (for Bankers),Pago,180,894,62,241,Beginner Level,17.5,2014-07-12,Business Finance,English,4.5,2014
682514,Professional Forex strategy,Pago,50,353,21,17,Expert Level,1.5,2016-02-03,Business Finance,English,4.23,2016
66383,A Beginners Guide to Technical Analysis of Stock Charts,Pago,40,829,78,50,Beginner Level,8.5,2013-09-15,Business Finance,English,4.2,2013
390198,Get out of Debt - The Power of Using Compounding Interest,Pago,50,1195,3,7,All Levels,2.0,2015-01-12,Business Finance,English,4.2,2015
679238,Day Trading - Learn to Day Trade / Swing Trade In One Hour.,Pago,95,335,25,29,All Levels,1.5,2015-11-27,Business Finance,English,4.23,2015
